"","id","uri","data","dataHoraRegistro","idOrgao","uriOrgao","siglaOrgao","idEvento","uriEvento","aprovacao","votosSim","votosNao","votosOutros","descricao","ultimaAberturaVotacao_dataHoraRegistro","ultimaAberturaVotacao_descricao","ultimaApresentacaoProposicao_dataHoraRegistro","ultimaApresentacaoProposicao_descricao","ultimaApresentacaoProposicao_idProposicao","ultimaApresentacaoProposicao_uriProposicao"
"75","2270971-22","https://dadosabertos.camara.leg.br/api/v2/votacoes/2270971-22",2021-03-02,2021-03-02 16:33:59,180,"https://dadosabertos.camara.leg.br/api/v2/orgaos/180","PLEN",0,NA,1,0,0,0,"Alteração do Regime de Tramitação desta proposição em virtude da Aprovação do REQ 321/2021.",NA,NA,NA,"Apresentação do Requerimento de Urgência (Art. 155 do RICD) n. 321/2021, pelo Deputado Hugo Motta (REPUBLIC/PB), que ""Requer urgência para a apreciação do Projeto de Lei 534/2021, de autoria do Senado Federal, que "Dispõe sobre a responsabilidade civil relativa a eventos adversos pós-vacinação contra a Covid-19 e sobre a aquisição e distribuição de vacinas por pessoas jurídicas de direito privado"".",2271064,"https://dadosabertos.camara.leg.br/api/v2/proposicoes/2271064"
"76","2270971-23","https://dadosabertos.camara.leg.br/api/v2/votacoes/2270971-23",2021-03-02,2021-03-02 16:33:59,180,"https://dadosabertos.camara.leg.br/api/v2/orgaos/180","PLEN",0,NA,1,0,0,0,"Aprovado requerimento n. 321/2021 do Sr. Hugo Motta que requer urgência para a apreciação do Projeto de Lei 534/2021, de autoria do Senado Federal, que "Dispõe sobre a responsabilidade civil relativa a eventos adversos pós-vacinação contra a Covid-19 e sobre a aquisição e distribuição de vacinas por pessoas jurídicas de direito privado.",NA,NA,NA,"Apresentação do Requerimento de Urgência (Art. 155 do RICD) n. 321/2021, pelo Deputado Hugo Motta (REPUBLIC/PB), que ""Requer urgência para a apreciação do Projeto de Lei 534/2021, de autoria do Senado Federal, que "Dispõe sobre a responsabilidade civil relativa a eventos adversos pós-vacinação contra a Covid-19 e sobre a aquisição e distribuição de vacinas por pessoas jurídicas de direito privado"".",2271064,"https://dadosabertos.camara.leg.br/api/v2/proposicoes/2271064"
"77","2266365-9","https://dadosabertos.camara.leg.br/api/v2/votacoes/2266365-9",2021-03-02,2021-03-02 16:52:55,180,"https://dadosabertos.camara.leg.br/api/v2/orgaos/180","PLEN",60451,"https://dadosabertos.camara.leg.br/api/v2/eventos/60451",1,0,0,0,"Aprovado, por unanimidade, o Requerimento de Urgência (Art. 155 do RICD).",NA,NA,NA,NA,0,NA
"78","2270971-36","https://dadosabertos.camara.leg.br/api/v2/votacoes/2270971-36",2021-03-02,2021-03-02 17:46:17,180,"https://dadosabertos.camara.leg.br/api/v2/orgaos/180","PLEN",60451,"https://dadosabertos.camara.leg.br/api/v2/eventos/60451",1,0,0,0,"Aprovado o Requerimento.",NA,NA,2021-03-02 17:01:48,"Parecer proferido em Plenário pelo Relator, Dep. Igor Timo (PODE-MG), pela Comissão de Constituição e Justiça e de Cidadania, que conclui pela constitucionalidade, juridicidade e técnica legislativa deste.",2271787,"https://dadosabertos.camara.leg.br/api/v2/proposicoes/2271787"
"79","2270971-50","https://dadosabertos.camara.leg.br/api/v2/votacoes/2270971-50",2021-03-02,2021-03-02 18:10:31,180,"https://dadosabertos.camara.leg.br/api/v2/orgaos/180","PLEN",60451,"https://dadosabertos.camara.leg.br/api/v2/eventos/60451",0,0,0,0,"Rejeitadas as Emendas de Plenário.",2021-03-02 17:53:02,"Votação das Emendas de Plenário, com parecer pela rejeição.",2021-03-02 17:58:30,"Parecer às Emendas de Plenário proferido pelo Relator, Dep. Igor Timo (PODE-MG), pela Comissão de Constituição e Justiça e de Cidadania, que conclui pela constitucionalidade, juridicidade e técnica legislativa.",2271817,"https://dadosabertos.camara.leg.br/api/v2/proposicoes/2271817"
"80","2270971-53","https://dadosabertos.camara.leg.br/api/v2/votacoes/2270971-53",2021-03-02,2021-03-02 18:12:15,180,"https://dadosabertos.camara.leg.br/api/v2/orgaos/180","PLEN",60451,"https://dadosabertos.camara.leg.br/api/v2/eventos/60451",1,0,0,0,"Aprovado o Projeto de Lei nº 534, de 2021, ressalvados os destaques.",2021-03-02 18:10:43,"Votação em turno único.",2021-03-02 17:58:30,"Parecer às Emendas de Plenário proferido pelo Relator, Dep. Igor Timo (PODE-MG), pela Comissão de Constituição e Justiça e de Cidadania, que conclui pela constitucionalidade, juridicidade e técnica legislativa.",2271817,"https://dadosabertos.camara.leg.br/api/v2/proposicoes/2271817"
"81","2270971-55","https://dadosabertos.camara.leg.br/api/v2/votacoes/2270971-55",2021-03-02,2021-03-02 18:25:56,180,"https://dadosabertos.camara.leg.br/api/v2/orgaos/180","PLEN",60451,"https://dadosabertos.camara.leg.br/api/v2/eventos/60451",0,0,0,0,"Rejeitada a Emenda de Plenário nº 4.",2021-03-02 18:11:25,"Votação do DTQ 5: PSB: Emenda de Plenário n. 4 (art. 161, II)",2021-03-02 17:58:30,"Parecer às Emendas de Plenário proferido pelo Relator, Dep. Igor Timo (PODE-MG), pela Comissão de Constituição e Justiça e de Cidadania, que conclui pela constitucionalidade, juridicidade e técnica legislativa.",2271817,"https://dadosabertos.camara.leg.br/api/v2/proposicoes/2271817"
"82","2270971-60","https://dadosabertos.camara.leg.br/api/v2/votacoes/2270971-60",2021-03-02,2021-03-02 19:01:54,180,"https://dadosabertos.camara.leg.br/api/v2/orgaos/180","PLEN",60451,"https://dadosabertos.camara.leg.br/api/v2/eventos/60451",NA,361,92,3,"Mantido o texto. Sim: 361; não: 92; abstenção: 2; total: 455.",2021-03-02 18:26:25,"Votação do DTQ 1: PCdoB: Destaque para votação em separado do parágrafo primeiro do art 2º do PL 534/2021. (art. 161, I)",2021-03-02 17:58:30,"Parecer às Emendas de Plenário proferido pelo Relator, Dep. Igor Timo (PODE-MG), pela Comissão de Constituição e Justiça e de Cidadania, que conclui pela constitucionalidade, juridicidade e técnica legislativa.",2271817,"https://dadosabertos.camara.leg.br/api/v2/proposicoes/2271817"
"83","2270971-69","https://dadosabertos.camara.leg.br/api/v2/votacoes/2270971-69",2021-03-02,2021-03-02 19:48:05,180,"https://dadosabertos.camara.leg.br/api/v2/orgaos/180","PLEN",60451,"https://dadosabertos.camara.leg.br/api/v2/eventos/60451",0,0,0,0,"Rejeitado o Destaque 7.",2021-03-02 19:02:20,"Votação do DTQ 7: PT: destaque da redação do §1º do artigo 2º do PL 534/2021, na redação dada pela Emenda de Plenário n. 5. (art. 161, II)",2021-03-02 17:58:30,"Parecer às Emendas de Plenário proferido pelo Relator, Dep. Igor Timo (PODE-MG), pela Comissão de Constituição e Justiça e de Cidadania, que conclui pela constitucionalidade, juridicidade e técnica legislativa.",2271817,"https://dadosabertos.camara.leg.br/api/v2/proposicoes/2271817"
"84","2270971-75","https://dadosabertos.camara.leg.br/api/v2/votacoes/2270971-75",2021-03-02,2021-03-02 20:03:20,180,"https://dadosabertos.camara.leg.br/api/v2/orgaos/180","PLEN",60451,"https://dadosabertos.camara.leg.br/api/v2/eventos/60451",0,0,0,0,"Rejeitado o Destaque 8.",2021-03-02 19:48:47,"Votação do DTQ 8: PT: destaque da redação do §3º do artigo 2º do PL 534/2021, na redação dada pela Emenda de Plenário n. 5. (art. 161, II)",2021-03-02 17:58:30,"Parecer às Emendas de Plenário proferido pelo Relator, Dep. Igor Timo (PODE-MG), pela Comissão de Constituição e Justiça e de Cidadania, que conclui pela constitucionalidade, juridicidade e técnica legislativa.",2271817,"https://dadosabertos.camara.leg.br/api/v2/proposicoes/2271817"
"85","2270971-76","https://dadosabertos.camara.leg.br/api/v2/votacoes/2270971-76",2021-03-02,2021-03-02 20:05:42,180,"https://dadosabertos.camara.leg.br/api/v2/orgaos/180","PLEN",60451,"https://dadosabertos.camara.leg.br/api/v2/eventos/60451",1,0,0,0,"Aprovada a Emenda de Redação nº 1.",2021-03-02 20:02:48,"Votação da Emenda de Redação nº 1.",2021-03-02 17:58:30,"Parecer às Emendas de Plenário proferido pelo Relator, Dep. Igor Timo (PODE-MG), pela Comissão de Constituição e Justiça e de Cidadania, que conclui pela constitucionalidade, juridicidade e técnica legislativa.",2271817,"https://dadosabertos.camara.leg.br/api/v2/proposicoes/2271817"
"86","2263411-32","https://dadosabertos.camara.leg.br/api/v2/votacoes/2263411-32",2021-03-02,2021-03-02 20:35:26,180,"https://dadosabertos.camara.leg.br/api/v2/orgaos/180","PLEN",60451,"https://dadosabertos.camara.leg.br/api/v2/eventos/60451",1,0,0,0,"Aprovado o Requerimento.",NA,NA,2021-03-02 20:09:59,"Parecer proferido em Plenário pelo Relator, Dep. Evair Vieira de Melo (PP-ES), que conclui pela constitucionalidade, juridicidade e regimentalidade, pelo atendimento dos pressupostos de urgência, relevância, imprevisibilidade, pela adequação orçamentária e financeira, e, no mérito, pela aprovação da MPV nº 1.004/2020.",2271841,"https://dadosabertos.camara.leg.br/api/v2/proposicoes/2271841"
"87","2263411-35","https://dadosabertos.camara.leg.br/api/v2/votacoes/2263411-35",2021-03-02,2021-03-02 20:40:12,180,"https://dadosabertos.camara.leg.br/api/v2/orgaos/180","PLEN",60451,"https://dadosabertos.camara.leg.br/api/v2/eventos/60451",1,0,0,0,"Aprovado, em apreciação preliminar, o Parecer da Comissão Mista, na parte em que manifesta opinião favorável quanto ao atendimento dos pressupostos constitucionais de relevância e urgência e à adequação financeira e orçamentária, nos termos do artigo 8º da Resolução nº 01, de 2002-CN.",2021-03-02 20:37:48,"Votação preliminar em turno único.",2021-03-02 20:09:59,"Parecer proferido em Plenário pelo Relator, Dep. Evair Vieira de Melo (PP-ES), que conclui pela constitucionalidade, juridicidade e regimentalidade, pelo atendimento dos pressupostos de urgência, relevância, imprevisibilidade, pela adequação orçamentária e financeira, e, no mérito, pela aprovação da MPV nº 1.004/2020.",2271841,"https://dadosabertos.camara.leg.br/api/v2/proposicoes/2271841"
"88","2263411-37","https://dadosabertos.camara.leg.br/api/v2/votacoes/2263411-37",2021-03-02,2021-03-02 20:41:24,180,"https://dadosabertos.camara.leg.br/api/v2/orgaos/180","PLEN",60451,"https://dadosabertos.camara.leg.br/api/v2/eventos/60451",1,0,0,0,"Aprovada a Medida Provisória 1.004, de 2020.",2021-03-02 20:41:05,"Votação, quanto ao mérito, em turno único.",2021-03-02 20:09:59,"Parecer proferido em Plenário pelo Relator, Dep. Evair Vieira de Melo (PP-ES), que conclui pela constitucionalidade, juridicidade e regimentalidade, pelo atendimento dos pressupostos de urgência, relevância, imprevisibilidade, pela adequação orçamentária e financeira, e, no mérito, pela aprovação da MPV nº 1.004/2020.",2271841,"https://dadosabertos.camara.leg.br/api/v2/proposicoes/2271841"
"89","2229141-54","https://dadosabertos.camara.leg.br/api/v2/votacoes/2229141-54",2021-03-02,2021-03-02 21:06:46,180,"https://dadosabertos.camara.leg.br/api/v2/orgaos/180","PLEN",60451,"https://dadosabertos.camara.leg.br/api/v2/eventos/60451",0,0,0,0,"Rejeitada a Emenda de Plenário.",2021-03-02 21:06:25,"Votação da Emenda de Plenário, com parecer pela rejeição.",2021-03-02 21:38:30,"Parecer às Emendas de Plenário proferido pela Relatora, Dep. Luisa Canziani (PTB-PR), pela Comissão de Constituição e Justiça e de Cidadania, que conclui pela constitucionalidade, juridicidade e técnica legislativa da Emenda de Plenário nº 2.",2271871,"https://dadosabertos.camara.leg.br/api/v2/proposicoes/2271871"
"90","2229141-55","https://dadosabertos.camara.leg.br/api/v2/votacoes/2229141-55",2021-03-02,2021-03-02 21:07:53,180,"https://dadosabertos.camara.leg.br/api/v2/orgaos/180","PLEN",60451,"https://dadosabertos.camara.leg.br/api/v2/eventos/60451",1,0,0,0,"Aprovado o Projeto de Lei 1.615, de 2019.",2021-03-02 21:06:25,"Votação da Emenda de Plenário, com parecer pela rejeição.",2021-03-02 21:38:30,"Parecer às Emendas de Plenário proferido pela Relatora, Dep. Luisa Canziani (PTB-PR), pela Comissão de Constituição e Justiça e de Cidadania, que conclui pela constitucionalidade, juridicidade e técnica legislativa da Emenda de Plenário nº 2.",2271871,"https://dadosabertos.camara.leg.br/api/v2/proposicoes/2271871"
"91","2268029-58","https://dadosabertos.camara.leg.br/api/v2/votacoes/2268029-58",2021-03-02,2021-03-02 21:38:20,180,"https://dadosabertos.camara.leg.br/api/v2/orgaos/180","PLEN",60482,"https://dadosabertos.camara.leg.br/api/v2/eventos/60482",1,0,0,0,"Aprovado o Requerimento.",NA,NA,2021-03-02 21:35:10,"Parecer proferido em Plenário pela Relatora, Dep. Renata Abreu (PODE-SP), pela Comissão de Constituição e Justiça e de Cidadania, que conclui pela constitucionalidade, juridicidade e técnica legislativa.",2271867,"https://dadosabertos.camara.leg.br/api/v2/proposicoes/2271867"
"92","2268029-67","https://dadosabertos.camara.leg.br/api/v2/votacoes/2268029-67",2021-03-02,2021-03-02 21:47:37,180,"https://dadosabertos.camara.leg.br/api/v2/orgaos/180","PLEN",60482,"https://dadosabertos.camara.leg.br/api/v2/eventos/60482",1,0,0,0,"Aprovada a Subemenda Substitutiva Global ao Projeto de Lei nº 5.638, de 2020, adotada pela Relatora da Comissão de Desenvolvimento Econômico, Indústria, Comércio e Serviços, ressalvados os destaques.",2021-03-02 21:44:26,"Votação em turno único.",2021-03-02 22:00:16,"Parecer às Emendas de Plenário proferido pela Relatora, Dep. Renata Abreu (PODE-SP), pela Comissão de Constituição e Justiça e de Cidadania, que conclui constitucionalidade, juridicidade e boa técnica legislativa das Emendas de Plenário nºs 1, 4, 7, 11, 12 e 14 e da Subemenda Substitutiva Global adotada pela Relatora da Comissão de Desenvolvimento Econômico, Indústria, Comércio e Serviços e pela inconstitucionalidade, injuridicidade e má técnica legislativa das Emendas de Plenário de nºs 2, 5, 6, 8 e 13.",2271875,"https://dadosabertos.camara.leg.br/api/v2/proposicoes/2271875"
"93","2270800-88","https://dadosabertos.camara.leg.br/api/v2/votacoes/2270800-88",2021-02-26,2021-02-26 15:20:56,180,"https://dadosabertos.camara.leg.br/api/v2/orgaos/180","PLEN",60446,"https://dadosabertos.camara.leg.br/api/v2/eventos/60446",0,0,0,0,"Rejeitado o Requerimento. Sim: 178; não: 302; abstenções: 3; total: 483.",2021-02-26 14:25:52,"Continuação da votação em primeiro turno.",NA,"Apresentação da Declaração de Voto n. 9 MESA, pela Deputada Luisa Canziani (PTB/PR).",2270988,"https://dadosabertos.camara.leg.br/api/v2/proposicoes/2270988"
"94","2270125-4","https://dadosabertos.camara.leg.br/api/v2/votacoes/2270125-4",2021-02-25,2021-02-25 11:38:22,6855,"https://dadosabertos.camara.leg.br/api/v2/orgaos/6855","CMO",60368,"https://dadosabertos.camara.leg.br/api/v2/eventos/60368",1,0,0,0,"Aprovado na 1ª Reunião Extraordinária em 25.2.2021, com o aditamento em que inclui os convidados representantes do Conselho Nacional de Saúde, Conselho Nacional de Secretários de Saúde (Conass) e Conselho Nacional de Secretarias Municipais de Saúde (Conasems).",NA,NA,2021-02-11 13:00:22,"Apresentação do Requerimento n. 1/2021, pela Deputada Carmen Zanotto (CIDADANIA-SC), que: ""Solicito que sejam enviados convites aos Ministérios da Saúde e Economia, para, em audiência pública, discorrer sobre o orçamento do Ministério da Saúde apresentado no Projeto de Lei Orçamentária Anual para 2021 -  PLN nº 28/2020"".",0,NA
"95","2270224-3","https://dadosabertos.camara.leg.br/api/v2/votacoes/2270224-3",2021-02-25,2021-02-25 11:41:42,6855,"https://dadosabertos.camara.leg.br/api/v2/orgaos/6855","CMO",60368,"https://dadosabertos.camara.leg.br/api/v2/eventos/60368",1,0,0,0,"Aprovado na 1ª Reunião Extraordinária em 25.2.21",NA,NA,2021-02-11 18:32:47,"Apresentação do Requerimento de Audiência Pública n. 2/2021, pelo Deputado José Nelto (PODE-GO), que: ""Requer a realização de audiência pública no âmbito da Comissão Mista de Planos, Orçamentos Públicos e Fiscalização - CMO para debater os cortes no orçamento da assistência social"".",0,NA
"96","2270857-4","https://dadosabertos.camara.leg.br/api/v2/votacoes/2270857-4",2021-02-25,2021-02-25 14:41:37,6855,"https://dadosabertos.camara.leg.br/api/v2/orgaos/6855","CMO",60368,"https://dadosabertos.camara.leg.br/api/v2/eventos/60368",1,0,0,0,"Aprovado na 1ª Reunião Extraordinária em 25.2.21 com a inclusão do convite para o Conselho Nacional de Secretários Estaduais de Educação (CONSED), União Nacional dos Dirigentes Municipais de Educação (UNDIME), Conselho Nacional das Instituições da Rede Federal de Educação Profissional, Científica e Tecnológica (CONIF) e Associação Nacional dos Dirigentes das Instituições Federais de Ensino Superior (ANDIFES).",NA,NA,2021-02-24 17:39:54,"Apresentação do Requerimento n. 3/2021, pela Deputada Professora Dorinha Seabra Rezende (DEM-TO), que: ""Solicito que sejam enviados convites aos Ministérios da Economia e da Educação, para, em audiência pública, seus titulares possam discorrer sobre a execução do orçamento de 2020 do Ministério da Educação e sobre a proposta orçamentária apresentada no projeto de Lei Orçamentária Anual para 2021 - PLN nº 28/2020"".",0,NA
"97","2270340-4","https://dadosabertos.camara.leg.br/api/v2/votacoes/2270340-4",2021-02-25,2021-02-25 11:25:29,6855,"https://dadosabertos.camara.leg.br/api/v2/orgaos/6855","CMO",60368,"https://dadosabertos.camara.leg.br/api/v2/eventos/60368",1,0,0,0,"Aprovado.",NA,NA,2021-02-17 15:42:44,"Apresentação da Proposta de Instrução Normativa n. 1/2021, pela Deputada Flávia Arruda (PL-DF), que: ""Regula os procedimentos para apresentação de emendas ao Projeto de Lei Orçamentária para 2021 (PL nº 28, de 2020-CN)"".",0,NA
"98","2270340-6","https://dadosabertos.camara.leg.br/api/v2/votacoes/2270340-6",2021-02-25,2021-02-25 12:09:38,6855,"https://dadosabertos.camara.leg.br/api/v2/orgaos/6855","CMO",60368,"https://dadosabertos.camara.leg.br/api/v2/eventos/60368",1,0,0,0,"Aprovado.",NA,NA,2021-02-17 15:42:44,"Apresentação da Proposta de Instrução Normativa n. 1/2021, pela Deputada Flávia Arruda (PL-DF), que: ""Regula os procedimentos para apresentação de emendas ao Projeto de Lei Orçamentária para 2021 (PL nº 28, de 2020-CN)"".",0,NA
"99","2270800-40","https://dadosabertos.camara.leg.br/api/v2/votacoes/2270800-40",2021-02-25,2021-02-25 16:54:43,180,"https://dadosabertos.camara.leg.br/api/v2/orgaos/180","PLEN",60432,"https://dadosabertos.camara.leg.br/api/v2/eventos/60432",0,136,237,3,"Rejeitado o Requerimento. Sim: 136; não: 237; abstenção: 2; total: 375.",NA,NA,NA,"Apresentação do Requerimento n. 296/2021, pelo Deputado Ricardo Silva (PSB/SP), que ""retirada de assinatura de pec 03 2021"".",2270892,"https://dadosabertos.camara.leg.br/api/v2/proposicoes/2270892"
"100","2270800-53","https://dadosabertos.camara.leg.br/api/v2/votacoes/2270800-53",2021-02-25,2021-02-25 17:38:44,180,"https://dadosabertos.camara.leg.br/api/v2/orgaos/180","PLEN",60432,"https://dadosabertos.camara.leg.br/api/v2/eventos/60432",0,161,296,3,"Rejeitado o Requerimento. Sim: 161; não: 296; abstenção: 2; total: 459.",NA,NA,2021-02-25 17:18:06,"Parecer proferido em Plenário pela Relatora, Dep. Margarete Coelho (PP-PI), pela Comissão Especial, que conclui pela aprovação da Proposta de Emenda à Constituição nº 3, de 2021, nos termos do Substitutivo apresentado.",2270957,"https://dadosabertos.camara.leg.br/api/v2/proposicoes/2270957"
"101","2270800-54","https://dadosabertos.camara.leg.br/api/v2/votacoes/2270800-54",2021-02-25,2021-02-25 17:44:37,180,"https://dadosabertos.camara.leg.br/api/v2/orgaos/180","PLEN",60432,"https://dadosabertos.camara.leg.br/api/v2/eventos/60432",0,0,0,0,"Rejeitado o Requerimento.",NA,NA,2021-02-25 17:18:06,"Parecer proferido em Plenário pela Relatora, Dep. Margarete Coelho (PP-PI), pela Comissão Especial, que conclui pela aprovação da Proposta de Emenda à Constituição nº 3, de 2021, nos termos do Substitutivo apresentado.",2270957,"https://dadosabertos.camara.leg.br/api/v2/proposicoes/2270957"
"102","2270800-61","https://dadosabertos.camara.leg.br/api/v2/votacoes/2270800-61",2021-02-25,2021-02-25 19:19:56,180,"https://dadosabertos.camara.leg.br/api/v2/orgaos/180","PLEN",60432,"https://dadosabertos.camara.leg.br/api/v2/eventos/60432",1,305,151,2,"Aprovado o Requerimento. Sim: 305; não: 151; abstenção: 1; total: 457.",NA,NA,2021-02-25 17:18:06,"Parecer proferido em Plenário pela Relatora, Dep. Margarete Coelho (PP-PI), pela Comissão Especial, que conclui pela aprovação da Proposta de Emenda à Constituição nº 3, de 2021, nos termos do Substitutivo apresentado.",2270957,"https://dadosabertos.camara.leg.br/api/v2/proposicoes/2270957"
"103","2270800-62","https://dadosabertos.camara.leg.br/api/v2/votacoes/2270800-62",2021-02-25,2021-02-25 19:44:38,180,"https://dadosabertos.camara.leg.br/api/v2/orgaos/180","PLEN",60432,"https://dadosabertos.camara.leg.br/api/v2/eventos/60432",0,149,307,2,"Rejeitado o Requerimento. Sim: 149; não: 307; abstenção: 1; total: 457.",NA,NA,2021-02-25 17:18:06,"Parecer proferido em Plenário pela Relatora, Dep. Margarete Coelho (PP-PI), pela Comissão Especial, que conclui pela aprovação da Proposta de Emenda à Constituição nº 3, de 2021, nos termos do Substitutivo apresentado.",2270957,"https://dadosabertos.camara.leg.br/api/v2/proposicoes/2270957"
"104","2270800-68","https://dadosabertos.camara.leg.br/api/v2/votacoes/2270800-68",2021-02-25,2021-02-25 20:16:45,180,"https://dadosabertos.camara.leg.br/api/v2/orgaos/180","PLEN",60432,"https://dadosabertos.camara.leg.br/api/v2/eventos/60432",0,150,311,3,"Rejeitado o Requerimento. Sim: 150; não: 311; abstenção: 2; total: 463.",NA,NA,2021-02-25 17:18:06,"Parecer proferido em Plenário pela Relatora, Dep. Margarete Coelho (PP-PI), pela Comissão Especial, que conclui pela aprovação da Proposta de Emenda à Constituição nº 3, de 2021, nos termos do Substitutivo apresentado.",2270957,"https://dadosabertos.camara.leg.br/api/v2/proposicoes/2270957"
"105","2270800-71","https://dadosabertos.camara.leg.br/api/v2/votacoes/2270800-71",2021-02-25,2021-02-25 21:01:11,180,"https://dadosabertos.camara.leg.br/api/v2/orgaos/180","PLEN",60432,"https://dadosabertos.camara.leg.br/api/v2/eventos/60432",1,310,127,6,"Aprovado o Requerimento. Sim: 310; não: 127; abstenção: 5; total: 442.",2021-02-25 20:36:12,"Votação do Requerimento do Bloco Parlamentar PSL, PL, PP, PSD, REPUBLICANOS, PTB, PROS, PODE, PSC, AVANTE, PATRIOTA, que solicita a votação em globo da admissibilidade dos destaques simples.",2021-02-25 17:18:06,"Parecer proferido em Plenário pela Relatora, Dep. Margarete Coelho (PP-PI), pela Comissão Especial, que conclui pela aprovação da Proposta de Emenda à Constituição nº 3, de 2021, nos termos do Substitutivo apresentado.",2270957,"https://dadosabertos.camara.leg.br/api/v2/proposicoes/2270957"
"106","2270800-75","https://dadosabertos.camara.leg.br/api/v2/votacoes/2270800-75",2021-02-25,2021-02-25 22:20:44,180,"https://dadosabertos.camara.leg.br/api/v2/orgaos/180","PLEN",60432,"https://dadosabertos.camara.leg.br/api/v2/eventos/60432",0,0,0,0,"Rejeitada a admissibilidade dos destaques simples: Sim: 146; não: 319; abstenção: 4; total; 469.",2021-02-25 21:01:19,"Votação, em globo, da admissibilidade dos destaques simples.",2021-02-25 17:18:06,"Parecer proferido em Plenário pela Relatora, Dep. Margarete Coelho (PP-PI), pela Comissão Especial, que conclui pela aprovação da Proposta de Emenda à Constituição nº 3, de 2021, nos termos do Substitutivo apresentado.",2270957,"https://dadosabertos.camara.leg.br/api/v2/proposicoes/2270957"
"107","2270696-2","https://dadosabertos.camara.leg.br/api/v2/votacoes/2270696-2",2021-02-24,2021-02-24 11:45:25,538891,"https://dadosabertos.camara.leg.br/api/v2/orgaos/538891","GT5G",60322,"https://dadosabertos.camara.leg.br/api/v2/eventos/60322",1,0,0,0,"Aprovado.",NA,NA,NA,"Apresentação do Requerimento de Audiência Pública n. 2/2021, pela Deputada Perpétua Almeida (PCdoB-AC), que: ""Requer a realização de Audiência Pública com o tema 'Apresentação da tecnologia 5G pelos principais fornecedores, funcionalidades, aspectos mercadológicos e de segurança cibernética', com os seguintes convidados: Huawei; Ericsson; Samsung; Nokia; Fujitsu"".",0,NA
"108","2270699-2","https://dadosabertos.camara.leg.br/api/v2/votacoes/2270699-2",2021-02-24,2021-02-24 11:46:27,538891,"https://dadosabertos.camara.leg.br/api/v2/orgaos/538891","GT5G",60322,"https://dadosabertos.camara.leg.br/api/v2/eventos/60322",1,0,0,0,"Aprovado.",NA,NA,NA,"Apresentação do Requerimento n. 3/2021, pela Deputada Perpétua Almeida (PCdoB/AC), que ""Requer a realização de Audiência Pública com o tema  'Impactos geopolíticos nas relações entre Brasil e no processo de construção das redes 5G no mercado brasileiro', com os seguintes convidados: Embaixador Luis Augusto de Castro Neves (CEBRI); Diplomata Tatiana Rosito; Professor Jorge Almeida (UFBA); Professor André Roberto Martin (USP); Presidente da FPA, deputado Sérgio Souza; Especialista em geotecnologia, Clarise Brown (Eurasia)"".",0,NA
"109","2270706-2","https://dadosabertos.camara.leg.br/api/v2/votacoes/2270706-2",2021-02-24,2021-02-24 11:46:54,538891,"https://dadosabertos.camara.leg.br/api/v2/orgaos/538891","GT5G",60322,"https://dadosabertos.camara.leg.br/api/v2/eventos/60322",1,0,0,0,"Aprovado.",NA,NA,NA,"Apresentação do Requerimento n. 4/2021, pela Deputada Perpétua Almeida (PCdoB/AC), que ""Requer a realização de Audiência Pública com o Excelentíssimo Ministro das Comunicações, Senhor Fábio Faria"".",0,NA
